{"activeIntake":{"baseBranch":"main","directory":"submissions","repository":"0xprogrammable/launch-policy","state":"closed"},"generatedAt":"2026-08-24T18:56:33Z","legacyIntake":[{"baseBranch":"main","continuingPullRequests":[62],"repository":"0xprogrammable/programmable"},{"baseBranch":"main","continuingPullRequests":[10,11,12,14,15,18,19,20],"repository":"0xprogrammable/hookbuilder"}],"records":[{"capabilities":["beneficiary-owned-rewards","buy-sell-fees","fixed-supply-token","initial-buy-custody","locked-liquidity","programmable-volume-fee"],"id":"classic","kind":"launch-model","name":"Classic","path":"registry/projects/classic/project.json","sha256":"sha256:e39276a06f6e6a7307dadb5fbe3e7f4163aefc69590c412add16462ab485ad34","status":"available","summary":"A fixed-supply token with independent buy and sell fees, beneficiary-owned ETH rewards, optional initial-buy custody, and permanently locked Uniswap v4 liquidity.","surfaces":["claim-interface","explorer","launch-interface","uniswap-v4-pool"],"tags":["classic","fee-token","fixed-supply","locked-liquidity","token-launch"]},{"capabilities":["locked-liquidity","programmable-volume-fee","quote-asset-rewards","stock-paired-token","tokenized-asset-quote"],"id":"stock-paired","kind":"launch-model","name":"Stock-Paired","path":"registry/projects/stock-paired/project.json","sha256":"sha256:3721379ecb6bb351c5c99d155251842a1be05891d2cf0cece00ac94b33dd925f","status":"candidate","summary":"A fixed-supply token paired with one reviewed tokenized stock or ETF quote asset, with quote-asset rewards and permanently locked Uniswap v4 launch liquidity.","surfaces":["claim-interface","explorer","launch-interface","uniswap-v4-pool"],"tags":["locked-liquidity","quote-asset","stock-paired","tokenized-assets"]}],"registryDigest":"sha256:7fb2b43e2a0ae8c1b5383273d55781e7ed5e7b0a3d9059c7c03e48437f01786d","schemaVersion":"1.0.0"}
